,연수명,내용,별점,등록일
2224,"참쌤스쿨 그림교실, 교사가 최고의 콘텐츠다",선생님들의 노하우를 알아가는 것 같아 유익했습니다.,rate5,2022.05.03
2225,서준호 선생님의 놀이 끝판왕 100,저학년 체육놀이 수업시간에 도움이 많이 되었습니다. 학생들의 즐거운 학교 생활을 위한 놀이가 많습니다. 덕분에 학생들에게 인기가 많은 선생님이 되었습니다.,rate5,2022.05.03
2226,학습격차를 줄이기 위한 슬기로운 수업방안,연수가 초등수업에는 적절하지 못한 듯요,rate3,2022.05.03
2227,"학습격차, 차이를 넘어 함께 성장하기",엄청 추천할 정도는 아닙니다.,rate3,2022.05.03
2228,꿈과 자존감이 자라는 교실 속 직업놀이 진로교육,많은 도움이 되었습니다.,rate5,2022.05.03
2229,"학습격차, 차이를 넘어 함께 성장하기","좋은 연수였습니다.
강사로 나온 선생님들의 교실에서의 다양한 적용을 보았습니다. 나도 적용헤 볼 수 있는 좋은 내용을 잘 선택하여 내가 현재 가르치고 있는 학생들에게 도움이 되었으면 합니다.",rate5,2022.05.03
2230,조병영의 문해력 수업,"문해력을 높이기 위한 개념들과 교실에서 활용할 수 있는 예시들
그리고 선생님들과의 대담!
선생님뿐만 아니라 부모님들이 봐도 좋을 연수입니다!
정말 알차고 좋은 연수였습니다
감사합니다",rate5,2022.05.02
2231,정재승의 미래학교,4차 산업혁명시대를 이끌어갈 미래 인재 양성을 위해 나는 어떤 교사로 거듭나야 하는가 누구나 한번쯤 고민해보았을 문제일 것 같습니다. 경력이 20년 넘어가면서 팬데믹시대에 '디지털 리터러시'가 어느 때보다 중요하다고 하는데 과연 이 시대에서 살아남을 수 있을까? 내가 살아남으려면 미래사회를 위해 무엇을 준비해야 하는걸까? 고민을 많이 하고 있는 즈음에 '정재승의 미래학교'를 들으면서 앞으로의 시간동안 어떻게 교사로서 역량을 키워 갈 것인가 방향을 잡을 수 있게 되었습니다. '열두 발자국'책을 읽을 때만큼 유익한 시간이었습니다. 감사합니다.,rate5,2022.05.02
2232,세상 쉬운 고교학점제! 진로 진학 끝판왕,좋은 연수 감사합니다,rate5,2022.05.02
2233,"완벽한 혁신을 위한 교육과정, 수업, 평가, 기록의 일체화","완벽한 혁신을 위한 교육과정, 수업, 평가, 기록의 일체화에 대해서 덕분에 많이 배우고 유익한 시간이었습니다.
감사합니다^^",rate5,2022.05.02
2234,"4R'S로 키우는 힘, 기초학력교육",좀 더 일찍 알았더라면....,rate5,2022.05.02
2235,설민석의 한국사능력검정시험[심화]-하,"정말 의미 있고 보람된 연수 시간이었습니다.
감사합니다.~!!",rate5,2022.05.02
2236,설민석의 한국사능력검정시험[심화],"원체 강의를 잘하시는 분이라 수업듣기가 매우 좋았어요. 다만 시험이 어려웠을 뿐..ㅎㅎ
시험 준비하시는 분은 들어봐도 좋을 연수입니다.",rate5,2022.05.02
2237,"기초학력교육, 관계형성이 먼저다.",실천이 어렵습니다. 구제가 안되네요 ㅠㅠ,rate5,2022.05.01
2238,세상 쉬운 고교학점제! 진로 진학 끝판왕,고교학점제에 대해 다양한 사례를 알 수 있는 유익한 연수였습니다.,rate5,2022.05.01
2239,놀이와 질문이 함께하는 감동의 그림책 수업,"수업은 늘 새로운 도전이다.
학생과 교사가 함께 성장할 수 있는 수업이라 감동이 있다.
책을 통해 놀이와 질문을 자유자재로 구사하며 재미있게 활동할 수 있는 연수라 도움이 된다.
이렇게 저렇게 재미있는 놀이들이 있었는데 잘 모르고 있었던 스스로에게 안타까왔다.
배웠으므로 교실에서 잘 적용해보고 싶다.
교사와 학생이 함께 성장하는 배움터를 함께 만들어가겠다.",rate5,2022.05.01
2240,정재승의 미래학교,매일 같은 생활의 반복 속에서 오지 않을 것 같은 미래. 하지만 곧 온다는 미래. 그 안의 교육에 대해 생각해 볼 수 있는 귀한 시간이었습니다.,rate5,2022.05.01
2241,정재승의 미래학교,"존경하는 정재승 교수님 께서 아이스크림 연수원에도 연수물을 올려주셔서 얼마나 감사했는지 모릅니다.

잘 모르는 분야에 대하여 조근조근 설명해주셔서 이해하기 쉽고 아이들에게 미래에 대한 이야기꺼리를 알려주셔서 감사드립니다",rate5,2022.05.01
2242,정재승의 미래학교,미래의 모습을 다시한번 생각해 볼 수 있는 기회를 갖게 되어서 흥미로웠던 연수였습니다.,rate4,2022.04.30
2243,두근두근! 1학년을 만나는 교사를 위한 한해살이 완벽 가이드 - 생활지도,"10년 넘게 1학년을 안 하다가 오랜 만에 1학년을 맡았는데, 이번 연수를 통해 내가 놓치고 있던 것이 무엇인지 알게 되었습니다.
놓치고 있던 것을 짚어줘서 좋았습니다.",rate5,2022.04.30
2244,"4R'S로 키우는 힘, 기초학력교육","학습 부진아 상황을 알고 그 상황 상항에 맞게 놀이 위주의 수업을 할 수 있도록 짜여진 강의라 듣기가 편했다. 특히 선생님들이 직접 놀이를 시범 보여 게임 방법을 알 수 있어 좋았고, 게임에 대한 어려움이 사라졌다. 강의 들은 후 바로바로 수업에 적용해보니 아이가 재미있어 하고 변화되는 모습을 볼 수 있어 정말 기뻤다.",rate5,2022.04.30
2245,정재승의 미래학교,"다양한 방면의 흐름을 여러 자료들을 활용하여 흥미롭게 살피고, 정재승 교수님의 강연으로 재미있게 접근할 수 있는 수업이었습니다. 앞으로 학생들을 교육하는데, 많은 도움이 된 것 같아요~^^",rate5,2022.04.30
2246,놀이와 질문이 함께하는 감동의 그림책 수업,정말 아이들이 좋아할만한 의미있고 유익한 책들과 놀이들을 만들어 주셔서 감사합니다^^,rate5,2022.04.30
2247,조병영의 문해력 수업,조병영 선생님의 문해력 수업이라는 연수를 통해 학교 현장에서 디지털미디어로 오히려 문해력이 되지 않고 있는 현실을 직관할 수 있게 해주었다. 무엇보다 현장에서 아이들을 가르치는데 있어 매우 도움이 되는 연수 였다. 내 자신 스스로 문해력을 키우기 위해 노력해야 겠다는 생각을 해본다.,rate5,2022.04.30
2248,뚝딱뚝딱 온앤오프 수업자료 만들기,"코로나 시대에 꼭 필요한 온라인 영상 수업 만들기, 컨텐츠 제작 및 업로드 등 등 넘 넘 유익한 강의 감사합니다.",rate5,2022.04.29
2249,"기초학력의 첫걸음, 한글교육","한글교육에 대한 구체적인 연수를 들어 본 적이 없었는데 이 연수는 구체적으로 실질적으로 현장에서 적용가능한 많은 전략을 알려주어서 좋았습니다.
예시를 들어 연수에 참가하신 분들의 활동을 보니 더욱 이해가 쉽고 도움이 많이 됩니다.",rate5,2022.04.29
2250,디지털 네이티브 아이들의 메타버스 세상,"요즘 비대면이 익숙해져서 학생들에게 흥미있는 수업이 무엇인지, 많은 고민을 하였는데,
메타버스는 학생들에게도 익숙하면서 흥미도를 높일 수 있는 수업방식이어서 많이 도움이 되었습니다.
매일 한 차시마다 수업사례를 알려주셔서 짧지만, 의미있는 강의였습니다.
또한, 메타버스에 관련한 지식들도 얻을 수 있어서 좋았던 강의였습니다.
감사합니다.",rate5,2022.04.29
2251,"학습격차, 차이를 넘어 함께 성장하기","큰 기대를 하지 않고 들었던 연수였습니다만, 기초학력향상을 위한 지도 방법이나 학생을 대하는 자세, 피드백 등에 대해 전반적인 윤곽이 잡힐 수 있게 만들어 주는 연수였습니다. 보다 세부적인 내용의 사례나 방법들이 있었으면 더 좋았을 것이란 생각이 드는 군요. 연수 잘 들었습니다.",rate5,2022.04.29
2252,"메이커교육이 뭐야? 무얼 만들어야 해? - 도구, 재료의 활용법","너무나도 알차고, 재미있는 연수였습니다.
메이커 교육 전반에 대한 이해와 개념 형성부터
다양한 메이커들의 이야기,
세계의 메이커페어를 같이 다녀온 것 같은 생생한 경험 나눔,
주변에서 흔히 접할 수 있는 재료를 다루는 방법 뿐 아니라 편리한 도구들에 대한 자세한 소개,
학생들과 다양한 메이커 활동을 도전해보고 싶게 만드는 프로그램과 기발한 미션들,
메이커 활동 중 발생할 수 있는 위험한 상황을 안전하게 지도할 수 있는 정확한 코칭까지!
연수가 끝났지만 더 듣고 더 배우고 싶은 마음이 드는 연수였습니다.
그대로 따라할 수 있겠다, 현장에 적용할 수 있겠다 라는 생각을 넘어서서
연수를 듣는 내내 나의 경험과 아이디어가 샘솟게 해 주는 멋진 연수입니다.
많은 분들께 추천하고 싶습니다. 좋은 연수 감사합니다.",rate5,2022.04.29
2253,설민석의 한국사능력검정시험[심화]-하,재미있게 잘 듣었습니다.,rate5,2022.04.29
2254,읽고 쓰고 만드는 그림책 수업,"그림책을 통해 글쓰기와 책읽기를 동시에 할 수 있는 프로그램입니다. 책읽기를 싫어하는 학생들에게는 책에 대한 흥미를 갖을 수 있고 글쓰기을 다양하게 하고자하는 교사나 학생에게는 다양한 소재를 제공하는 그림책, 정말 좋은 학습자료입니다.",rate5,2022.04.29
2255,세상 쉬운 고교학점제! 진로 진학 끝판왕,"확실히 고교학점제는 이론적인 측면에서 많이 접할 수 있었지만
실제 사례는 알기 어려운 점이 있었습니다 연수 덕분에 많이 배울 수 있어 좋았어요",rate5,2022.04.28
2256,디지털 네이티브 아이들의 메타버스 세상,"메타버스에 전반적인 이야기를 들을 수 있어요
교육과 메타버스의 접목도 알수있구요!
그러나, 메타버스의 프로그램의 구체적인 사용방법이나 실례를 구체적으로 볼 수는 없어서
조금 아쉬웠습니다~

다른 선생님께 도움이 되었으면 하는 마음에 후기를 남깁니다!
감사합니다^^",rate4,2022.04.28
2257,"학습격차, 차이를 넘어 함께 성장하기",유익한 연수,rate4,2022.04.28
2258,함소아 한의원 김한빛 원장이 들려주는 우리아이 체질별 지도법,체질별 특성에 대한 내용이 더 있었으면 하는 아쉬움도 있습니다.,rate4,2022.04.28
2259,"민주시민의 길, 평화와 통일교육","평화통일교육을 교과에서, 동아리활동에서, 진로교육과 연계하여, 융합교과 혹은 프로젝트 수업으로 실시할 수 있는 여러가지 팁을 짚어주셔서 유용했습니다. 감사합니다.",rate5,2022.04.28
2260,정재승의 미래학교,"와아! 교수님^^
들으면 들을수록 교수님이 맞다는 생각이 듭니다.
변화할 미래에 대비하기 위한 교육의 방향을 명쾌하게 알려주셔서 감사합니다!",rate5,2022.04.28
2261,"학습격차, 차이를 넘어 함께 성장하기","두 분 강사선생님께 감사드립니다.
참으로 아이들 생각하는 마음으로 한 명 한 명의 아이들에게 최선을 다하고 계실것 같은 두 분 강사선생님께 많은 것 배웠습니다. 감사합니다.",rate5,2022.04.28
2262,"학습격차, 차이를 넘어 함께 성장하기",새롭게 알게 된 내용이 많았아요.,rate5,2022.04.28
2263,세상 쉬운 고교학점제! 진로 진학 끝판왕,유익하고 좋은 연수였습니다.,rate5,2022.04.28
2264,"학습부진, 기초튼튼! 실력쑥쑥!",학습장애와 학습부진에 대한 올바른 개념 및 자세히 알지 못했던 학습부진아의 상담전략과 교과별 학습에 대해 많은 도움을 받았습니다다. 감사드립니다.,rate5,2022.04.28
2265,정재승의 미래학교,미래사회가 궁금했는데 어느 정도 도움 받았습니다.,rate3,2022.04.28
2266,꿈과 자존감이 자라는 교실 속 직업놀이 진로교육,"작년 이수진선생님의 책을 받아들고는 어둡고 길고 험난했던 저의 교사의 길이 드디어 종지부를 찍고 새롭게 시작하는 계기가 되었습니다. 늘 좋은 선생님이 되고 싶고 아이들에게 다가가고 싶었는데, 그 방법을 몰랐던 것이지 제게 교사의 자질이 부족한것이 아니였다는 용기를 얻게해 준 연수였어요. 그래서 전 교실속 직업놀이는 아이들뿐 아니라 교사의 꿈과 자존감을 자라게하는 교육이라고 생각합니다. 너무 행복하고 제 삶이 정말 많이 달라짐을 느낍니다. 단 한가지 안타까운 것이 있다면 왜 이제서야 이런 학급경영방법이 세상에 나왔는지, 한 십년만 내가 늦게 교사가 되었으면 얼마나 좋을까 싶은 아쉬움이 있지요 ㅎㅎㅎ 하지만 남은 교직생활이 단 1년이라도 전 후회없이 직업놀이를 할거에요. 수많은 교육방법들 중 가장 현실적이고, 또 가장 따뜻하고, 가장 효과적이고, 불가능하다 생각했던 개별화교육, 협력학습, 진로교육, 학부모와의 관계 등등 꿈꾸던 모든 교실이 가능해지게 하는 엄청난 비밀이 숨겨있는 이 직업놀이는 교사가 하기 전혀 어렵지도 않다는 겁니다. 저처럼 교사는 나의 적성의 정반대에 있다고 생각하는 사람도 그 어떤 교육방법보다 쉬웠고 바로바로 달라짐을 느끼게 해주는 마법같은 교육비책이었으니까요. 우리나라 교육 여건 속에서 또 얼마나 절묘하게 녹아들었는지, 3월 첫날부터 시작해 종업식을 하는 그 마지막 순간까지도 작은 것 하나도 꾹꾹눌러담은 감동의 교육 현장을 느껴볼 수 있습니다. 너무 좋고 너무 대단한 것을 마주하면 무슨 말을 어떻게 해야할 지 막막해지는 순간이 오는데 지금 이 연수후기를 적고 있는 제가 딱 그렇네요. 좋은 기회로 연수를 듣게 되신 축복받은 선생님들께서 용기내어 해보셨음 좋겠습니다. 그리고 카페에 함께 나누고 계시는 동료샘들도 많으셔서 진짜 도움이 너무 많이 됩니다. 이렇게 어떤 학급경영방법을 배우고 친절하게 AS까지 해주시는 강사님은 또 처음 뵙습니다. 너무너무 감사드립니다. 진짜 세상의 덕은 다 쌓으셨난봅니다 ㅎㅎㅎ 다시한번 선생님의 마법같은 교육방법을 이세상에 내놓아주셔서 감사드립니다. 존경합니다^^",rate5,2022.04.27
2267,뚝딱뚝딱 온앤오프 수업자료 만들기,"뚝딱뚝딱 수업자료를 혼자서도 만들수 있으면 좋겠다는 기대감으로 연수를 신청하고 받게 되었어요
수업자료를 만들어 유아와 함께 많이 활용해 보고 싶네요
즐겁고 행복한 연수시간이었습니다",rate5,2022.04.27
2268,설민석의 한국사능력검정시험[심화]-하,중요 내용이 잘 정리되어 좋습니다.,rate5,2022.04.27
2269,"학습격차, 차이를 넘어 함께 성장하기","코로나로 인해 학습 격차가 더 심해짐을 수업 중에 느낄 수 있는 상황에서 함께 성장할 수 있는 방안을 연수로 선택했다.
좋은 점은 실제 사례를 들어 설명하고 공유해 주어 활용을 할 수있다는 점이 좋았다. 또한 두 분 선생님께서 이야기하듯이 강의를 해 주셔서 편안하게 연수를 들을 수있었고, 적용도 할 수 있을 것 같아 좋은 연수 였습니다.",rate5,2022.04.27
2270,"틀을 깬 수업, 미래 교실을 열다","전통적 수업방식에 익숙해져 있던 교실상황에서 본 연수를 듣고 교사가 수업의 주연이 아닌 학생중심 수업의 중요성에 대해 새롭게 그 의미를 되새기게 된 유익한 연수였다.
나름대로 새롭고 활동중심 수업을 계획하고 이끌려고 노력했으나 코로나 팬데믹으로 인해 다시 예전의 일제 수업방식으로 바뀌어져 간 것 같았는데 이번 연수를 듣고 틀을 깬 수업방식에 대해 아이디어를 떠올리고 적용하게 되었다.
본 연수에서 제시한 다양한 교육적 이론과 교육방법 들 중 특히 비쥬얼싱킹, 연꽃기법, 학급일기, 색안경 학습지, 미션실험 활동지, 영화평론활동, 만다라트 활동, 러닝맨 활동, 사칙연산활동 등은 수업중 다양하게 활용될 것 같아 끝까지 연수를 들은 보람이 있어 기뻤다.
좋은 연수, 수업활동 장면을 통해 활용 방법까지 자세히 안내, 정보를 제공해 주신 영근쌤께 감사의 인사를 전합니다.",rate5,2022.04.26
2271,디지털 네이티브 아이들의 메타버스 세상,"메타버스라는 단어가 많이 들려오는데 그것이 무엇인지 정확하게 몰랐다.
교육에 어떻게 접목해야할지, 미래에 학교는 어떻게 바뀔지...
조금은 엿볼 수 있는 연수였다. 아이들에게 교육의 방법이 옛날과는 달라져야함을 다시 한번 깨달았고,
그러기 위해서는 내가 시대의 흐름을 빠르게 따라가야한다는 생각도 들었다.
이번 연수에서 알게 된 내용을 어떻게 교육에 접목시켜 함께 할 수 있을까 고민해봐야겠다.

특히 마지막 강의에서 한계점을 말씀하시는 현장 교사의 말이 가장 기억에 남는다.
나 혼자 하기엔 시간과 노력이 많이 필요하지만 함께하면 결국 새로운 교육에 대한 방법을 찾을 수 있을 것이다.",rate5,2022.04.26
2272,뚝딱뚝딱 온앤오프 수업자료 만들기,"원격수업에서 재미있게 활용할 수 있는 수업자료를 제작할 수 있었습니다.
컴퓨터 활용 능력이 부족했는데 차근차근 따라하며 여러 가지 자료로 수업했어요
감사합니다",rate5,2022.04.26
2273,정재승의 미래학교,학생들이 얼마나 더 알고 있는 지가 중요한 것이 아니라 꾸준히 관심을 가지고 학습하는 방법에 대해 생각하게 만드는 연수였습니다.,rate5,2022.04.26
2274,"마을이 잇는 교육, 교육이 짓는 아이들 마을교육공동체(실무자편)",마을교육 공동체에 대한 다양한 사례과 연결 방법 등 유익하고 도움이 되는 교육이었습니다.,rate5,2022.04.26
2275,놀이와 질문이 함께하는 감동의 그림책 수업,현장에서 그림책을 어떻게 활용하는지 궁금했는데 본 연수를 통하여 활용법을 잘 알 수 있었어요 감사합니다.,rate5,2022.04.26
2276,세상 쉬운 고교학점제! 진로 진학 끝판왕,좋은 연수 감사합니다.,rate5,2022.04.26
2277,뚝딱뚝딱 온앤오프 수업자료 만들기,정말 실제로 활용할 수 있는 좋은 연수였습니다. 교사가 직접 나와 강의하는 방식이어서 현실적인 문제도 알려주어 좋았습니다. 설명하는 방식도 아이들에게 해 주는 방식으로 이해하기 쉬었습니다. 너무 좋았습니다. 추후 이런 강의가 더 준비되었으면 좋겠습니다.~,rate5,2022.04.26
2278,안전교육 SOS - 아이들을 부탁해!,안전교육을 쉽게 이해하고 현장에 적용해 볼 수 있어서 좋았습니다.,rate5,2022.04.26
2279,세상 쉬운 고교학점제! 진로 진학 끝판왕,"좋은 연수 감사합니다.
고교학점제에 대한 이해를 높일 수 있었습니다.
다양한 학교의 사례와 졸업생의 인터뷰가 기억에 남습니다.",rate5,2022.04.26
2280,전문가가 알려주는 창의 영재교육의 비법,"지역 영재원에서 주는 영재 프로그램 교본에 비해 영재에 대한 이론이 탄탄했고, 영재 프로젝트 수업에 대한 힌트를 얻을 수 있어 좋았어요.",rate5,2022.04.25
2281,정재승의 미래학교,초등학교에 근무하기에 앞날이 창창한 어린이들에게 지적 호기심을 많이 가질 수 있는 안목을 키워주는 교육을 해야겠다는 생각을 하며 연수를 들었습니다. 배움의 즐거움을 경험하여 도파민 분비가 보상으로 따르기에 강요하지 않아도 스스로 배우고자 하는 열망을 아이들에게 심어줄 수 있다면 이 연수는 너무나 값진 결과를 가져다 줄 것이기에 감사를 드립니다.,rate5,2022.04.25
2282,"학습부진, 기초튼튼! 실력쑥쑥!",학습 부진의 원인과 지도 방법에 대한 많은 도움이 된 알찬 연수였습니다.,rate5,2022.04.25
2283,세상 쉬운 고교학점제! 진로 진학 끝판왕,매우 유익한 연수였습니다.~~,rate5,2022.04.25
2284,"즐거운 대화, 하브루타로 수업하기","학생들도 어른들도 문제 해결점 또는 서로를 이해할 수 있는 과정이 있는 하브루타 수업이라는 생각입니다.
초등학교 저학년 학생들과도 스스로 생각하고 말해보게 하는 과정에서 깨달음을 얻고 생각이 자랄 수 있도록 할 수 있을것 같은 희망이 보여요
감사합니다.",rate5,2022.04.25
2285,읽고 쓰고 만드는 그림책 수업,"보통 연수를 들으면 30~40%는 대충 그냥 흘러 들을 버릇했었는데, 그림책 연수는 관심이 있었고, 초등 현직선생님께서 생생한 경험을 가지고 한 연수라서 한 차시도 빼먹지 않고 다 들었습니다. 선생님의 열정이 뜨겁게 느껴지는 후끈한 연수라서, 덩달아 기분 좋게 배우면서, 현장에서 나도 한 번 해 보고 싶다는 생각을 들게 만드는 연수였습니다.
강사님과 항상 내가 사랑하는 아이스크림 원격교육연수원에 감사드립니다!",rate5,2022.04.25
2286,정재승의 미래학교,"정말 유익한 강의였습니다. 정재승교수님이 미래에 학교에서 학생들을 교육할때 필요한 역량을 중심으로 잘 소개해 주셔서, 다가올 미래를 잘 대비하고 생각해보는 계기가 되었습니다. 특히나 아주 재미있고 자연스럽게 강의가 진행되어, 매우 만족했습니다. 다음에도 또 이런 연수가 개설되길 바랍니다.",rate5,2022.04.25
2287,허쌤의 짬짬이 교실놀이,짬짬이 놀 수 있는 간단하고 즐거운 놀이를 소개해 주셔서 감사합니다. 코로나로 지친 아이들에게 조금이나마 친구들과 어울려서 쉬며 웃을 수 있는 교실 공간을 만들기 위해 무엇이 없을까 고민 중에 좋은 아이디어를 만나게 되어 기쁩니다. 감사합니다.,rate5,2022.04.25
2288,"학습부진, 천천히 함께 걷기",좋은 연수입니다~,rate5,2022.04.25
2289,"기초학력교육, 관계형성이 먼저다.","진도율 관리 때문에 접속 시간 위주가 아닌 점이 매우 좋습니다
보고 싶은 부분만 빠르게 확인 가능해서 편했습니다~",rate5,2022.04.25
2290,"기초학력교육, 관계형성이 먼저다.",학습부진학생지도는 교사와 학생간의 관계형성에서부터 시작하여야 한다는 말이 무척 인상에 남습니다. 늘 주눅들어있고 하기싫은 학생들을 붙들고 시름하는 나의 모습과 오버랩되면서 스스로를 되돌아보는 계기가 되었습니다. 먼저 학생들을 이해하려는 노력이 선행되어야하고 학생의 입장에서 생각하고 고민하는 노력이 바탕이 되어야겠습니다. 스스로 할려는 의지를 가지도록 하려는 동기강화에 더욱 주력하면서 기초학력교육 4R’S 지도법 꼭 참고하겠습니다. ~~,rate5,2022.04.25
2291,세상 쉬운 고교학점제! 진로 진학 끝판왕,다양한 사례를 통해 고교학점제를 이해할 수 있는 연수여서 좋았어요,rate5,2022.04.25
2292,"학습부진, 기초튼튼! 실력쑥쑥!","반에 부진학생들이 있어 고민이 되었는데
부진학생들을 조금이나마 이해하고
지도하는데 도움이 많이 되었습니다!!",rate5,2022.04.25
2293,세상 쉬운 고교학점제! 진로 진학 끝판왕,"중학교 근무 2년차! 급변하는 교육현장 속 피할 수 없는 고교학점제~
학생들에게 전달할 알찬 내용들이 담겨져 있어서 유익한 연수였어요^^
아직 뭘 해야 할지.. 꿈을 찾아가는 중학생들의 진로 진학 끝판왕! 세상 쉬운 고교학점제 연수
저도 고등학교 현장을 이해할 수 있었던 뜻깊은 시간이었습니다~
연수비용도 전남교육청에서 지원해주니 편하게 들었네요^^ 감사합니다~~",rate5,2022.04.25
2294,정재승의 미래학교,"유익하고 즐거운 연수였습니다.
듣는내내 재밌게 잘들었고 미래학교에 대한 저나름대로 어느 정도의 개념정리가 되었습니다. 감사합니다.",rate5,2022.04.25
