,연수명,내용,별점,등록일
736,"소통하는 학교, 참여하는 수업을 위한 교사의 퍼실리테이션 역량키우기","강의식 수업 조용한 교실을 탈피하기 위해 듣게 된 연수입니다. 코로나 이후 더 적막한 교실이 되어 버려 반성이 되어 듣게 되었습니다 .
철학적 관점 학생에 대한 시각 변화 등 새로운 차원의 생각을 해 보게 되었습니다. 실천을 위해서 더 많은 노력이 필요하지만 연수를 통하여 살아 있는 교실에 대해 다시 한번 생각해 보는 계기가 되었습니다.",rate5,2023.01.12
737,"다함께 Green 미래 환경 교육, 기후위기에 대처하는 에코(ECO) 지식 토크쇼","우연히 듣게 된 연수 인데 그동안 안일했던 환경에 대한 생각을 바꾸는 계기가 되었습니다.
딱딱한 이론식 강의 대신 재미있는 토크콘서트를 가미해 한강 한강 몰입해서 연수를 들을수 있었습니다. 빙하가 녹고 북극 남극의 온난화가 얼마나 심각한지 그로 인한 지구에 미치는 영향이 얼마나 심각한지 진지하게 생각해보게 되었습니다. 모기가 극성인 이유 등 환경변화 하나하나가 연쇄적인 관계가 있다는 것도 알게 되었습니다. 미래를 살아가야하는 자녀들과 학교 학생들에게 심각성을 인식시캐는 교육, 환경 보호를 실천해야함을 인식시키는 교육이 꼭필요함을 느끼게 된 소중한 연수였습니다. 적극 추천하고 싶은 연수입니다.",rate5,2023.01.12
738,"학습격차, 차이를 넘어 함께 성장하기","'학습격차'를 줄이기 위한 연수라기 보다는 여러가지 수업방법, 지도방법에 대한 폭넓은 맛보기 정도의 연수였던것 같아요. '학습부진'에 초점을 둔 집중지도의 방법을 찾기위한 연수 목적에는 맞지 않았네요",rate4,2023.01.10
739,EBS다큐프라임으로 배우는 생태전환교육,"작년에 처음 생태전환교육을 아이들과 함께 하며 스스로 생태전환교육에 대한 지식이 부족함을 느껴 신청하게 되었다.
학교 현장에 직접 적용할 수 있는 방법적인 면보다 기본 배경지식으로써 역할에 충실한 연수였다.",rate5,2023.01.10
740,"소통하는 학교, 참여하는 수업을 위한 교사의 퍼실리테이션 역량키우기","연수가 즐거웠고 의미있었습니다.
어떻게 교무회의를 소통하며 진행할수 있는지 학부모와 어떻게 이야기를 나눌수 있을지
학생들에게 어떻게 퍼실리테이션 역량을 키워줄수 있을지
수업 속에 어떻게 소통능력을 활용할수 있는지 등
다양한 방법으로 안내되어 좋았습니다
특히, 연수 마지막에는 퍼실리테이션으로 앞으로 어떻게 성장할 수 있고
은퇴후에도 활용할수 있는 점이 기억에 남았습니다. 감사합니다. ^^",rate5,2023.01.10
741,조병영의 문해력 수업,광범위하고 이론이 많아 조금 지루한감이 있지만 현장에서 다루어지는 내용이 많아 필요한 연수입니다.,rate4,2023.01.09
742,EBS다큐프라임으로 배우는 생태전환교육,너무 도움이 많이 되었습니다. 앞으로도 좋은 강의 부탁드립니다^^,rate5,2023.01.09
743,더 나은 삶을 위한 민주시민교육,"민주시민교육의 중요성이 날로 대두됨에 따라 사회나 도덕 혹은 국어 교과에서 주로 가르치는 내용이라고 생각된 '민주시민교육'에 관한 연수를 들었다. 과학교과에서 사회적 참여, 기후위기, 한정된 자원과 에너지의 관점에서 시민교육이 필요하다고 생각되었다. 관련 주제에 대해 배경, 현재의 문제, 해결책 등에 대해 조사하고 발표하는 형식으로 수업을 진행했으나 실제로 학생들이 자신의 의견을 정책에 반영되도록 게재할 수 있도록 가르치는 것도 중요할 것이다.",rate5,2023.01.09
744,EBS다큐프라임으로 배우는 생태전환교육,자연의 아름다움을 담은 양질의 다큐멘터리 영상을 볼 수 있어 좋은 연수였다. 다른 연수의 영상을 시청할 때보다 마음이 편해지는 느낌이 들어 좋았다. 더 좋았던 것은 절대 간과할 수 없는 현재의 기후 위기(기후 변화)라는 내용을 담고 있었다는 것이다. 자연의 아름다움과 다양성으로 시작하는 차시에서부터 지구의 온도 변화와 인간의 멸종이라는 마지막 차시에 이르기까지 부족함 없는 좋은 연수였다. 기후 위기의 심각성을 깨닫고 환경 교육을 시작하여 지금이라도 우리의 행동을 바꾸는 데 많은 사람이 동참했으면 하는 바람이다.,rate5,2023.01.08
745,전문가가 알려주는 창의 영재교육의 비법,"● 창의융합형 인재양성을 위해 교사의 능력을 향상시킬 수 있다.
● 창의력을 키우는 영재교육 활동을 교실 현장에 적용할 수 있다.

이 연수 소개에 나오는 학습목표입니다.
창의성을 가르칠 수는 없지만, 창의성을 위한 여러 가지 지도방법이 연구되며 시도되고 있습니다. 4차 산업혁명 시대에 적합한 창의융합형 인재를 양성하기 위한 교육으로 창의 수업에 대한 요구가 많아지고 있습니다. 일단, 강의진이 좋습니다.

그동안의 창의 영재교육에 데이터와 인공지능까지 결합하여 정말 유용한 연수였습니다. 영재교육원에서 실시하는 양질의 수준높은 실제 수업을 바탕으로 교실에서 활동 중심의 창의 수업을 설계할 수 있도록 구성했으며, 실제로 이 연수의 강의를 해주시는 분 가운데에서 대학원에서 관련하여 정말 유익한 강의를 해주신 교수님도 계십니다. 믿을 만한 연수입니다.",rate5,2023.01.08
746,놀이와 질문이 함께하는 감동의 그림책 수업,강의가 세밀하고 친절하게 진행해 주셔서 현장에서 아이들과 그림책 수업을 유익하게 활용할 수 있을것 같습니다.,rate5,2023.01.08
747,디지털 네이티브 아이들의 메타버스 세상,추상적으로 느껴졌던 메타버스를 우리 주변의 구체적인 생활 영역으로 배울 수 있었던 연수였습니다,rate5,2023.01.07
748,직업탐구 - 별일입니다,몰랐던 직업에 대해서 많이 알 수 있어서 좋았던 것 같습니다.,rate5,2023.01.07
749,직업탐구 - 별일입니다,"다양한 직업군의 사람들이 자신의 직업에 대해서 진솔하게 이야기한다.
필요한 적성이나 준비, 학생들에게 들려주는 조언 등을 통해 진로 역량을 키울 수 있는 기회를 제공한다.",rate5,2023.01.07
750,쏭내관과 함께하는 랜선궁궐기행2,쏭내관과 함께하는 역사 공부는 언제나 재미있고 유익해요. 궁궐에 숨어있는 이야기를 알 수 있어서 좋았어요.,rate5,2023.01.07
751,조병영의 문해력 수업,문해력이 무엇인지 생각해 볼 수 있는 연수였습니다.,rate5,2023.01.07
752,온라인에서도 놀자! 허쌤의 비접촉놀이,"아이들에게 바로 적용해 볼 수 있는 쉽고 유익한 연수!

시간 가는 줄 모르고 들었습니다",rate5,2023.01.06
753,함소아 한의원 김한빛 원장이 들려주는 우리아이 체질별 지도법,"사실 한의학에서 말하는 사상의학이 학생 지도와 어떤 관련이 있을까 하는 궁금증으로 연수를 받게 되었는데, 연수를 들으며 학생 뿐만 아니라 주위 사람들에 대한 이해가 되면서 '맞아, 그런 것 같아!'하는 생각을 하며 매 차시 흥미롭게 연수를 들을 수 있었던 것 같습니다. 사람의 성격을 한 마디로 단정 지을 수는 없지만 체질을 이해하면 그 사람이 가지고 있는 기본 성향에 대한 이해가 바탕이 되어 학생을 지도할 때 조금은 편안한 마음으로 지도할 수 있게 된다는 면에서 도움이 되는 연수였습니다. 감사합니다.^_^",rate5,2023.01.06
754,EBS다큐프라임으로 배우는 생태전환교육,"생태계에 대한 새로운 정보도 알게되었고, 교육자료까지 배송해주셔서 학기 중에 창체수업에 잘 활용할 것 같습니다.",rate5,2023.01.05
755,온라인-오프라인 연계 수업 따라잡기,유익한 연수였습니다.,rate5,2023.01.04
756,수업과 성장을 돕는 과정중심평가_초등 심화,의무 연수 이수로 15차시 강의를 수강함.,rate5,2023.01.02
757,조병영의 문해력 수업,아이들의 입장을 이해할 수 있었어요. 참 좋은 연수였습니다.,rate5,2023.01.02
758,놀이와 질문이 함께하는 감동의 그림책 수업,그림책을 이용한 수업에 많이 도움이 되는 연수였습니다.,rate5,2023.01.02
759,두근두근! 1학년을 만나는 교사를 위한 한해살이 완벽 가이드 - 학습지도,"1학년을 한번도 안 해 보아서 궁금하기도 하고, 새학기에 어떤 학년을 맡게될지는 모르나 걱정을 줄이기 위해 연수를 들었습니다. 강사님이 말을 많이 하는 편이라서 처음에는 좀 지루했지만, 속도를 빠르게 하고 들으니 들을만합니다. 또 1학년을 직접 운영해 보신 실질적인 내용이라서 배울 게 참 많습니다. ppt가 들어가고 강사님 얼굴은 작게 나온 화면이면 더 좋을텐데....넘 부담스럽네요. 강사님 얼굴이 엄청 크게 나와서....좋은 자료, 정보도 감사합니다. 1학년에 대한 막연한 두려움이 좀 사라지네요.",rate5,2023.01.01
760,"학습격차, 차이를 넘어 함께 성장하기",함께 성장해요,rate5,2022.12.31
761,두근두근! 1학년을 만나는 교사를 위한 한해살이 완벽 가이드 - 생활지도,"올해 학교를 옮기고 11년 만에 1학년 담임이 되었습니다. 어떻게 해야 할 지 가늠이 되지 않아서

'두근 두근! 1학년을 만나는 교사를 위한 한해살이 완벽 가이드'연수를 신청해서 들었습니다.

연수 내용은 담임으로서의 마음가짐, 아침시간, 수업시간, 점심시간, 하교, 청소하는 법, 학부모 상담 전 준비사항 등 다양하게
세분화 되어 있습니다. 강사선생님께서 아주 친절하게 잘 설명해 주십니다.

학부모 상담 전에는 일부러 연수를 복습해서 다시 듣고 상담을 진행했습니다.
2학년 담임 경험도 있고, 최근에는 중학년 담임을 많이 했던 터라... 많은 도움이 되었습니다.

오랜만에 1학년 담임을 하게 된 선생님들이나 신규선생님들께 추천합니다.
또, 여러 해동안 저학년 담임을 했더라도... 요즘 1학년들은 어떤 특성을 가졌는지 알기를 원하신다면 이 연수를 들어보셔요. 참고가 될 거라 생각됩니다. 감사합니다.",rate5,2022.12.31
762,조병영의 문해력 수업,"요즘 아이들, 코로나로 인해 잃어버린 2년 동안 문해력 많이 떨어져있죠.
그런데 문득 문해력, 문해력 하는데 도대체 문해력이 뭐야? 싶었어요.
독해력이랑 문해력이랑 뭐가 다른데?
도대체 문해력이 뭐길래 이렇게 유행이야?

그래서 신청하게 되었습니다.
본 강의를 통해 문해력의 정의에 대해 이해할 수 있었고
문해력 증진을 위해 어떻게 수업해야 하는지 감을 잡을 수 있었습니다.

내년도 교육과정을 짤 때에는 문해력에 대해 고민해보아야겠습니다.

감사합니다. ^^",rate5,2022.12.31
763,정재승의 미래학교,"평소에 정재승 교수님을 좋아하고 존경해서 TV프로그램이나 영상을 찾아보는 편이었는데... 연수로 정재승 교수님을 만나게 되어 참 좋은 시간이 되었습니다.'미래교육'이라고 하는 거대담론을 전문성과 현장성을 겸비한 교수님의 편안한 목소리로 들으면서 어쩌면 가장 바쁜 시기, 짬짬이 힐링하는 기분으로 연수를 듣게되어 주변 지인에게도 적극 추첮하고 있습니다. 앞으로도 단방향 강의 위주가 아닌 이렇게 현장성에 기반한 전문성을 겸비한 분들이 편안하게 대화하듯 기획하여 연수가 운영되면 좋겠습니다. 시기에 맞는 주제와 딱 맞는 강사로 연수 운영해주셔서 감사합니다!!",rate5,2022.12.31
764,읽고 쓰고 만드는 그림책 수업,다양한 그림책들을 소개해 주셔서 감사합니다. 학생들과 그림책을 창작할 때 많은 도움이 될 것 같습니다.,rate5,2022.12.29
765,전문가가 알려주는 창의 영재교육의 비법,영재 교육에 대해 어렴풋이 갖고 있던 의문들이 다 풀렸다. 이해하기 쉽게 설명해주셔서 너무 좋았다.,rate5,2022.12.29
766,"학습부진, 기초튼튼! 실력쑥쑥!","학습부진 학생을 항상 잘 지도하고 있는 건지 의문이 들었는데
느린 학생을 기다려준다는 게 그 학생에게는 얼마나 큰 도움이 되는지 다시금 생각하게 되었네요.
앞으로 어떻게 가르쳐야 할지 조금 더 감이 잡힌 듯합니다.",rate5,2022.12.29
767,두근두근! 1학년을 만나는 교사를 위한 한해살이 완벽 가이드 - 생활지도,"항상 느끼는 거지만 1학년을 가르치다 보면 막다른 길에 마주하게 될 때가 많은데요.
이럴 때는 어떻게 대처해야 하지? 몇 번을 시뮬레이션해도 보기에 없던 상황으로 새로운 당황을 주곤 합니다.
그럴 때 유용하게 대처할 수 있는 연수! 추천합니다.",rate5,2022.12.29
768,두근두근! 1학년을 만나는 교사를 위한 한해살이 완벽 가이드 - 학습지도,말로만 듣던 1학년에 대해 자세하게 알 수 있는 시간이었습니다. 본 강의에서 나온 팁들은 혹시라도 내년에 1학년 담임을 하게 되었을 때 아주 유용하게 써먹을 수 있을 것 같습니다.,rate5,2022.12.29
769,EBS다큐프라임으로 배우는 생태전환교육,"선명한 화질과 음향으로 만나는 생태전환교육은 지구 환경에 대한 새로운 시각을 갖게 해준 소중한 시간이었습니다. 인간의 편리를 위해 만들어진 문명과 개발이 생태계에 얼마나 악영향을 미치는지 깨닫게 되었습니다. 작은 식물이나 동물들도 그 생명을 지키고, 번식하기 위해 엄청난 노력을 하고 있다는 것이 경이로웠습니다. 우리의 소중한 지구를 잃지 않기 위한 생태전환교육의 중요성을 알고, 학생들에게도 알려주어야겠다고 생각했습니다.",rate5,2022.12.28
770,Let's AI 인공지능 교육 활용편,"펜데믹 이후 인공지능 교육에 대해 관심이 많이 생겼지만 어디서부터 시작해야할지 알 수 없었습니다.
마침 아이스크림연수원에 관련 연수가 있었고 들으면서 생각을 정리해볼 수 있는 계기가 되었어요.
감사합니다.",rate5,2022.12.28
771,학습격차를 줄이기 위한 슬기로운 수업방안,"현직 국어, 수학, 사회 선생님께서 강사로 나오셔서 실질적인 노하우를 알려주시는 연수입니다.
학습격차를 줄이기 위해 노력하시는 선생님들께 경의를 표하며 이런 실질적인 연수를 마련해주셔서 감사합니다.",rate4,2022.12.28
772,"학습부진, 천천히 함께 걷기","학습부진 학생들의 지도에 있어 유익한 연수였습니다.

빨리 가는것이 아니라 천천히 함께 걷는것의 중요함을 다시금 인지하게 된 계기였습니다.",rate5,2022.12.28
773,놀이와 질문이 함께하는 감동의 그림책 수업,다양한 책들과 관련 수업활동까지 많은 것을 배울 수 있는 연수 였습니다.,rate5,2022.12.28
774,핵심만 콕! 수업에 바로 쓰는 메타버스,즐거운연수였습니다.추천합니다!!!^^,rate5,2022.12.28
775,두근두근! 1학년을 만나는 교사를 위한 한해살이 완벽 가이드 - 생활지도,이야기가 귀에 잘 들어오게 차분하게 설명해 주셨고 재미있었습니다.,rate5,2022.12.27
776,꿈과 자존감이 자라는 교실 속 직업놀이 진로교육,교실에서 할 수 있는 여러 가지 진로 교육에 대해 알게 되었습니다.,rate5,2022.12.27
777,설민석의 한국사능력검정시험[심화]-상,"설민석의 한국사능력검정시험 연수가 많은 도움이 되었습니다. 연수 초기에는 내용이 많아 힘들었지만, 조금씩 나아졌습니다. 또한 학기말에 유익하게 단기간 연수를 받을 수 있어서 너무 다행이었습니다. 감사합니다.",rate5,2022.12.27
778,놀이와 질문이 함께하는 감동의 그림책 수업,그림책 수업을 여러번 해보고싶었지만 독후활동의 부담감이 항상 있었습니다. 하지만 이번 연수를 통해 놀이와 함께하는 그림책 수업을 통해 아이들에게 즐겁게 그림책 읽는 즐거움을 느끼게 해줄 수 있을 것 같고 그림책 속의 여러 의미들을 아이들에게 자연스럽게 내면화시킬 수 있을 것 같아서 유익한 연수였습니다^^,rate5,2022.12.27
779,"기초학력교육, 관계형성이 먼저다.","기초학력교육 향상 방안을 배우고자 이 연수를 수강하였습니다.
3학년 학급에 기초학력 미달 학생이 있었는데, 뜻대로 지도되지가 않아 어려움이 있었습니다.
관계형성과 읽기, 쓰기, 셈하기 그리고 영어 영역까지 기초학력교육 방안에 대해 배울 수 있었습니다.",rate5,2022.12.27
780,"기초학력교육, 관계형성이 먼저다.",기초연수 내용에 충실한 연수였어요,rate5,2022.12.27
781,"소통하는 학교, 참여하는 수업을 위한 교사의 퍼실리테이션 역량키우기","학생, 교직원간 의견 나눔에 있어서 필요한 내용 잘 들었습니다.",rate5,2022.12.27
782,조병영의 문해력 수업,"다양하고 객관적인 자료를 제시해 주셔서 더 이해하기 쉬웠습니다.
요새 문해력이라는 말이 많이 나오는데, 정확하게 알 수 있는 연수였습니다.",rate5,2022.12.26
783,한 번에 끝내는 미래 교육! 디지털 어벤져스의 특별한 AI 특강,실제적인 것이 더 있었으면 하는 아쉬움이 남습니다.,rate4,2022.12.26
784,정재승의 미래학교,"미래교육에 대해 고민하시는 분이라면 꼭 한 번 들어봐야하는 연수입니다.
정재승 교수님의 다방면에 걸친 해박한 지식에 감탄하고 우리의 교육이 나아갈 방향을 생각할 수 있게 해준 연수였습니다.
너무너무 많은 것을 얻고 갑니다. 감사합니다.",rate5,2022.12.26
785,"기초학력교육, 관계형성이 먼저다.",필수로 들어야하는 연수 잘 들었습니다,rate5,2022.12.26
786,설민석의 한국사능력검정시험[심화],"점수를 위해 들은 연수이지만 한국사에 대한 정리가 잘 되었습니다.

특히 근현대사에 대한 이해도가 높아져서 매우 만족합니다.

시험은 난이도가 중간정도 되는 것 같습니다. 아무튼 좋은 연수 감사합니다.",rate5,2022.12.26
787,EBS다큐프라임으로 배우는 생태전환교육,생태전환과 관련된 다양한 컨텐츠를 짜임새 있게 구성한 연수였습니다.,rate5,2022.12.26
788,정재승의 미래학교,유익한 연수 감사합니다,rate5,2022.12.26
789,핵심만 콕! 수업에 바로 쓰는 메타버스,유익한 연수였습니다,rate5,2022.12.26
790,설민석의 한국사능력검정시험[심화]-상,한국사 공부하는데 도움을 받았습니다. 유익한 연수 추천합니다.,rate5,2022.12.25
791,서준호 선생님의 놀이 끝판왕 100,영상까지 있어 게임을 어떻게 운영할 수 있는지 직관할 수 있어 이해도가 높았다. 학교 현장에서 잘 활용할 수 있는 훌륭한 연수!!!,rate5,2022.12.24
792,쏭내관과 함께하는 랜선궁궐기행 종합편,그동안 궁궐에 대해 몰랐던 것을 자세히 알 수 있는 연수였습니다. 궁궐에 이렇게 재미있는 이야기가 숨어 있다는 것을 알 수 있는 시간이었습니다. 학생들의 역사 공부를 위해 연수를 신청하였는데 재미있는 궁궐 이야기를 들려주고 현장체험학습시 새로운 이야깃 거리를 해 줄 수 있어서 좋았습니다. 유익하고 정말 좋은 연수였습니다.,rate5,2022.12.24
793,EBS다큐프라임으로 배우는 생태전환교육,환경과 인간의 삶에 관해 깊이 있게 공부할 수 있는 시간이었음,rate4,2022.12.24
794,읽고 쓰고 만드는 그림책 수업,재밌어요 유익했어요,rate5,2022.12.23
795,정재승의 미래학교,"아이스크림에서
연수 듣길 잘했습니다
감사합니다 ^_^",rate5,2022.12.23
796,"참쌤스쿨 그림교실, 교사가 최고의 콘텐츠다",컨텐츠에 관한 자세한 내용들이 있어 좋았습니다,rate5,2022.12.22
797,"참쌤스쿨 그림교실, 교사가 최고의 콘텐츠다",알찬 연수였습니다. 감사합니다!,rate5,2022.12.22
798,핵심만 콕! 수업에 바로 쓰는 메타버스,"메타버스가 무엇인지 조금이나마 알게되어서 너무 좋았습니다.
학급에서도 잘 사용해보고 싶습니다.",rate5,2022.12.21
799,EBS다큐프라임으로 배우는 생태전환교육,"다큐를 베이스로 한 환경연수는 매우 중요한 영역이며, 앞으로 미래세대를 위한 매우 중요한 부분이라 생각합니다.",rate5,2022.12.21
800,쏭내관과 함께하는 랜선궁궐기행 종합편,직접 가볼 수는 없지만 이야기와 엮어 들으니 더 기억에 남습니다!,rate5,2022.12.21
801,EBS다큐프라임으로 배우는 생태전환교육,굿입니다 너무 감사합니다,rate5,2022.12.21
802,꿈과 자존감이 자라는 교실 속 직업놀이 진로교육,"비슷한 듯 하지만 전혀 다른 학급운영으로 세금내는 아이들이 있습니다. 어떤 것이 더 낫다 우열을 가리기엔 장단이 뚜렷합니다. 다만, 이 직업놀이 학급 운영에는 비경쟁적인 요소가 많아 공동체 의식, 배려의식 등을 키우기에 매우 좋았습니다. 인성 지도의 측면에서는 이 연수가 제일이라고 생각합니다.",rate4,2022.12.20
803,"4R'S로 키우는 힘, 기초학력교육",부진학생들에 대하여 막연한 지도 보다 연수를 통해 조금이나마 방향을 알고 어떻게 지도 할 지 알게되었습니다. 다름 선생님들에게도 추천하고 싶은 유익한 연수입니다.,rate5,2022.12.20
804,세상 쉬운 고교학점제! 진로 진학 끝판왕,23학년도 1학년부터 시행되는 고교학점제에 대비하여 학교에서 강사분들 초청하여 연수를 듣기도 하였지만 이번 연수를 통해서 연구학교와 미국 대학의 훌륭한 프로그램을 보면서 고교학점제의 지향점을 더 잘 알게 되었습니다. 본격적인 시행을 앞두고 기대감 보다는 해결해야 할 과제에 대한 우려가 더 깊은 현실이지만 학생들의 진로와 미래 사회에 필요한 역량과 보다 더 연계된 교육과정이 실현되길 희망하며 연수를 들었습니다. 유익한 연수였습니다.,rate5,2022.12.20
805,설민석의 한국사능력검정시험[심화],만족합니다,rate5,2022.12.20
806,"마을이 잇는 교육, 교육이 짓는 아이들 마을교육공동체",앞으로의 교육이 어떻게 가야할 지 방향을 제시해주는 유익한 연수였습니다,rate5,2022.12.20
807,"질문하는 공부법, 하브루타로 생각하고 실행하기",창의적으로 문제를 해결할 수 있게 공부할 수 있는 유익한 연수였습니다.,rate5,2022.12.19
808,놀이와 질문이 함께하는 감동의 그림책 수업,다양한 활동과 그림책을 활용한 수업이 도움이 되었습니다.,rate5,2022.12.19
809,전문가가 알려주는 창의 영재교육의 비법,"영재교육 연수를 위해 이수하였지만 아주 만족하는 연수 결과였습니다.
다른 분들께도 추천드립니다!",rate5,2022.12.19
810,직업탐구 - 별일입니다,진로전담교사로서 직업 체험을 계획할 때 대충 알고 있었던 직업과 관련된 다양한 이야기들을 실제 직업인으로 부터 들을 수 있는 기회라 좋았습니다. 여러 가지 진로교육 연수를 들어보았지만 대부분 진로교육의 개론에 대한 내용이 많아 실제로 학교에서 학생들에게 진로교육을 할 때 도움이 되는 연수는 별로 없었습니다. 그런데 이 연수는 학생들이 관심이 있어 하는 직업들이 대부분이고 그 직업에서 학생들이 궁금해하고 알고 싶어하는 것도 속시원하게 이야기 해 주셔서 좋았습니다. 학년말이라 시간이 될 때마다 한 가지씩 반 학생들에게 보여주고 싶습니다.,rate5,2022.12.19
811,실전! 창의 수업 전략,이런 연수를 무료로 들을 수 있다는 점이 참 감사한 점입니다. 많은 도움이 되었습니다~~!,rate5,2022.12.19
812,핵심만 콕! 수업에 바로 쓰는 메타버스,멀게만 느껴졌던 메타버스! 강의를 듣고 쉽게 이해할 수 있었습니다.,rate5,2022.12.19
813,설민석의 한국사능력검정시험[심화],국사 시간에 사건의 제목만 알고 공부했던 연수 였는데 사건의 내용을 알 수 있는 연수였다.,rate5,2022.12.19
814,한 번에 끝내는 미래 교육! 디지털 어벤져스의 특별한 AI 특강,AI를 활용하는 수업이 궁금해서 수강해보았습니다. 수업에 활용하는 있는 여러 가지를 알려주셔서 좋았어요~,rate5,2022.12.19
