,연수명,내용,별점,등록일
1504,조병영의 문해력 수업,"문해력이란 무엇인가 문식성 독해능력 문해능력...문해력이 중요하다고 하여 EBS문해력 유치원부터 영상을 시청하면서 조병영 교수님을 알게 되었다. 조병영 교수님이 지은 책을 읽다가 어렵다고 느꼈는데 강원도교육청에서 지원하는 문해력수업 연수를 수강하면서 리터러시에 대해 아주 아주 조금은 발을 담그게 된 것 같다. 영상이 넘쳐나는 시대에 책을 읽는 것도 힘들고, 글을 읽고 이해하는 능력이 어려운 학생들을 보면서 저학년, 고학년 시기의 문해력이란 무엇일까에 대해 계속 고민하게 된다. 문해력이 성적에 영향을 주는 것만은 분명해 보인다. 성적 뿐 아니라, 개인이 살아가면서 계약서, 약복용서, 설명서 등등을 읽고 이해하지 못한다면 개인 삶의 질이 매우 떨어질 것이다. 문해력이 좋으면 학생들에게 나쁠 것이 없는 것 같다. 문해력에 대해 고민하시는 선생님들께 연수를 추천한다.",rate4,2022.09.05
1505,디지털 네이티브 아이들의 메타버스 세상,"추천합니다.

디지털 네이티브 아이들의 메타버스 세상",rate5,2022.09.05
1506,"학습격차, 차이를 넘어 함께 성장하기",평소 학습격차가 많이 나는 우리 반을 많이 걱정했는데 이 연수를 통해 어떻게 지도할지 길을 찾았습니다. 감사합니다.,rate5,2022.09.04
1507,두근두근! 1학년을 만나는 교사를 위한 한해살이 완벽 가이드 - 학습지도,"1학년 담임을 십여년 만에 하게 되었습니다. 1학기 적응 과정이 험난한 것은 짐작했지만 기본생활습관, 기본학습태도가 전혀 없는 상황이 역시나 당황스럽더라고요. 경력이 부끄러워지는 순간이 여럿 떠오르네요. 2학기 개학을 하며 초심으로 돌아가고자 연수를 듣게 되었습니다. 다시 출발하는 마음으로 연수를 감상하니 유익하고 알찬 연수였습니다. 2학기 잘 보내겠습니다",rate5,2022.09.04
1508,읽고 쓰고 만드는 그림책 수업,"강사님의 많은 노하우를 전수 받아 바로 수업에 활용하기 좋아요.
저도 그림책 만들기까지 갈 수 있을지는 모르지만 마음의 준비와 강사님의 노하우로 도전해보겠습니다.",rate5,2022.09.04
1509,"다함께 Green 미래 환경 교육, 기후위기에 대처하는 에코(ECO) 지식 토크쇼",무조건적인 환경 위기에 대한 두려움을 떨쳐낼 수 있는 해결 방안을 모색해 볼 수 있는 나름의 유익한 시간이었다.,rate5,2022.09.03
1510,조병영의 문해력 수업,"교사로서 20년간 가르쳐 오면서 읽기 더딤 학생이 점점 많아지고 있다는 느낌을 갖게 됐는데,
이전에는 드러나지 않았지만 이제는 도움이 필요한 많은 아이들이 그래도 초반에 발견되고 있어 다행이라는 생각도 든다.
교육청 연수도 요즘 '읽기'에 대한 강조를 하고 있는데 그만큼 기초학력 신장을 위해서는 '읽기'가 학습에 있어서 정말 중요한 기본 도구라는 것이다. 이것을 어떻게 가르쳐야 할 것인가?
어떻게 책을 읽게 할 것인가? 어떻게 스스로 책을 찾아 읽게 하고 즐겁게 성장할 수 있는 독자가 되게 할 것인가?
이 연수는 이런 질문들에 대한 답이 되는 연수일 것이다.
미리보기를 통해 이 연수의 한 강좌를 잠깐 볼 때는 확신은 장담 못했지만
들으면 들을수록 잘 선택했다는 생각이 든다.
교사의 답답함을 왜 그런지 명쾌하게 설명해주고, 마음 한 구석의 짐을 덜어낼 수 있는 해결책도 제기해 주기 때문에
많은 교사들에게 강려히 추천한다.",rate5,2022.09.03
1511,미술 속 진짜 아이심리 사로잡기,"미술시간에 다양한 아이들의 심리에 대하여 잘 알 수 있었습니다.
다음미술시간에 아이들을 대하는 태도가 바뀔 것 같네요",rate5,2022.09.02
1512,허쌤의 짬짬이 교실놀이,교실에서 간단히 할 수 있는 교실놀이를 학급에서 활용하겠습니다.,rate5,2022.09.02
1513,정재승의 미래학교,너무나 참신해서 또 듣고 싶다.,rate5,2022.09.02
1514,"기초학력교육, 관계형성이 먼저다.",학급담임을 할때마다 기초학력이 저하된 학생이 있어서 가르치기가 막연하고 어려워서 연수를 신청했어요. 개인마다 다른 기초학력이 저하된 상태라 학생마다 적절한 수업설계가 필요했는데 좋은 연수를 배울 기회가 있어서 큰 도움이 되었어요. 감사합니다.,rate5,2022.09.02
1515,디지털 네이티브 아이들의 메타버스 세상,"매일 매시간 마다 시시각각 시대적 환경이 바뀌고 있는 현대사회에 적응하기 위해 학습하면 좋을 연수입니다.

디지털 네이티브 아이들의 메타버스 세상",rate5,2022.09.02
1516,핵심만 콕! 수업에 바로 쓰는 메타버스,"메타버스가 뭐지라는 막연한 생각으로 연수를 신청했는데
메타버스에 관하여 이해할 수 있는 기회가 되었습니다.",rate5,2022.09.02
1517,"다함께 Green 미래 환경 교육, 기후위기에 대처하는 에코(ECO) 지식 토크쇼","학교에서 이뤄지는 생태환경교육을 돌아보면 막막해지는 순간이 있습니다.
""왜, 채식급식해요?""
""왜, 플라스틱 쓰면 안 돼요?""
""왜, 전기를 아껴 써야 해요?""
고기가 탄소 배출량이 많다던가, 플라스틱은 썩지 않는다, 전기를 많이 쓰면 탄소 배출량이 많아진다 정도의 설명만 해주는 경우도 많았습니다. 그랬기 때문에 아이들은 생활 속 소비들을 인류의 멸종과 연관 짓지 못하고 반쪽자리 시켜서 하는 환경 캠페인을 하는 게 전부입니다.
이 연수를 듣고 나면 내 행동 기후 위기에 어떤 영향을 끼치는지 그 사이사이 모든 것들을 알 수 있습니다. 또한 최신의 연구 결과를 바탕으로 앞으로 닥쳐올 미래의 최악의 종말까지도 제시해 줍니다.
생태환경교육이 중요해지는 이 시점에서 선생님들께 꼭 추천해 주고 싶은 연수입니다.",rate5,2022.09.01
1518,"학습격차, 차이를 넘어 함께 성장하기",학습격차를 줄이기 위한 여러가지 방법들 잘 들었습니다. 적용이 중요하곘네요,rate5,2022.09.01
1519,뚝딱뚝딱 온앤오프 수업자료 만들기,"인디스쿨을 통해 여러 현장 선생님들의 수업 자료를 받아 도움받고 싶은데
어느 정도 저만의 수업자료를 만들고 싶은 욕심이 생겨
이 연수를 듣게 되었습니다.
몇가지 자료를 수업을 들으며 만들다 보니 흥미가 생기고
이를 활용한 응용자료도 만들게 되어 정말 좋았어요",rate5,2022.09.01
1520,"나도 재미있는 메이커교육(영상활용과 온, 오프라인 메이커활동)","수업 현장에서 학생들에게 흥미를 불러 일으킬 수 있는 자료를 만들고 싶고,
학생들과의 추억을 담을 수 있는 영상자료를 만들고 싶어 이 연수를 들었는데
맨 처음에는 조금 어렵고 버벅거렸지만 힘들어도 하다보니
얻어가는게 있네요 유익한 연수였습니다.",rate5,2022.09.01
1521,학습격차를 줄이기 위한 슬기로운 수업방안,"학습 현장에서 항상 느끼는 학생들간 학습격차!!
특히 수학시간에 계산 속도나 이해력에 따른 문제 해결 속도 격차 때문에 항상 고민합니다.
이런 계기로 이 연수를 신청하게 되었는데
강의를 통해 학생들의 학습격차로 인해 생기는 문제들을 조금이나마 해소시킬 수 있을거 같아
연수를 듣고 기분 좋았습니다.",rate5,2022.09.01
1522,온라인-오프라인 연계 수업 따라잡기,여러 곳의 선생님들을 초빙해서 교과목 별로 블렌디드 수업 사례를 알려주셔서 감사합니다. 많은 도움이 되었습니다.,rate5,2022.09.01
1523,함소아 한의원 김한빛 원장이 들려주는 우리아이 체질별 지도법,"내 아이도, 반 아이도 적용 가능한 알아두면 좋은 팁같은 연수였습니다. 괜찮았어요!",rate5,2022.09.01
1524,"참쌤스쿨 그림교실, 교사가 최고의 콘텐츠다","코로나가 유행하던 2020년 초반에 아이들과 원격수업에 활용하기 위해 들었던 연수입니다.
요새 워낙 다양한 콘텐츠로 아이들과 수업하는 시대라 들어두면 좋을 것 같습니다.",rate5,2022.09.01
1525,"학습부진, 천천히 함께 걷기","학습부진에 대해 학습장애와 구분하여 이해하고 어떻게 지도계획을 세우고 지도해야 하는지 알게 되었다
특히 읽기와 쓰기, 수학 장애의 특성과 교수방법을 구체적으로 알려주어 도움이 되었다",rate5,2022.08.31
1526,"4R'S로 키우는 힘, 기초학력교육","수세기가 늦은 친구들을 이해하게 되면서 한 걸음 물러나, 교사인 나에게도 쉼을 주게 됩니다.
천천히 익히는 친구가 있을 때 좀더 여유를 두고 지도하게 됩니다. 감사합니다.",rate5,2022.08.31
1527,설민석의 한국사능력검정시험[심화]-하,흐름을 잘 짚어주고 쉽게 이해하고 기억할 수 있도록 해주는 강의입니다. 너무 좋아요.,rate5,2022.08.31
1528,설민석의 한국사능력검정시험[심화]-상,역시 설명을 너무 재미있게 귀에 쏙쏙 들어오게 해주세요. 너무 좋아요.,rate5,2022.08.31
1529,핵심만 콕! 수업에 바로 쓰는 메타버스,비교적 쉬운 것들은 수업에 활용 할 수 있을 것 같아요 ^^,rate5,2022.08.31
1530,뚝딱뚝딱 온앤오프 수업자료 만들기,"배우고 싶었던 뚝딱뚝딱 온앤오프 수업 자료 만들기 연수~ 너무 유익했고 덕분에 많이 배웠습니다.
어렵다라고 느껴졌는데 이번 연수를 통해 이해하기 쉽게 설명해주셔서 현장에서 꼭 활용해봐야 겠다는
생각이 들었습니다. 알찬 연수 감사합니다~^^",rate5,2022.08.31
1531,"학습격차, 차이를 넘어 함께 성장하기","학습 격차는 교사로서 피할 수 없는 숙제인데
어떤 식으로 접근해야 하는지에 대해서 많은 정보를 얻을 수 있었습니다.
특히 초등학교 아이들은 격차가 장기화 되면 수업에 흥미를 잃게 될 수 있는데 이러한 상황에서 벗어날 수 있는 정보를 많이 모을 수 있어 좋았습니다.",rate5,2022.08.31
1532,핵심만 콕! 수업에 바로 쓰는 메타버스,잘 배웠습니다.,rate2,2022.08.31
1533,"기초학력의 첫걸음, 한글교육","기초 학력의 첫걸음, 한글교육 연수 추천합니다.~",rate5,2022.08.31
1534,"참쌤스쿨 그림교실, 교사가 최고의 콘텐츠다",수업중 그림을 접목하면 좋을것같습니다,rate5,2022.08.30
1535,쏭내관과 함께하는 랜선궁궐기행 종합편,역사를 보다 재미있게 배울 수 있는 좋은 시간이었습니다. 다른 선생님들께도 추천하고 싶습니다.,rate5,2022.08.30
1536,뚝딱뚝딱 온앤오프 수업자료 만들기,"최고의 연수였습니다!! 다른 선생님들께 강추합니다. 현직 선생님들이 강의해 주시니 더더욱 이해가 쏙쏙 되었습니다. 코로나19로 인해 선생님들에게 더더욱 필요해진 각종 온라인, 오프라인 수업자료 만들기 기능을 배울 수 있습니다. 그림 자료 다루기, PPT 뿐만 아니라, 동영상 제작, 동영상 자료에 더빙하기 등 고급 기술들까지 익힐 수 있어 굉장히 유익한 연수입니다. 예를 들면, 그림파일 종류별(jpg와 png) 차이점 같이 이미 쓰는 기능들이지만 그냥 지나칠 수 있는 정보들부터 멸치, 클로바 더빙, 캡컷 등 컴퓨터 기능이 익숙하지 않은 교사들에게는 다소 생소한 프로그램들까지 자세하게 실습하며 설명해 주시니 많은 도움이 되었습니다. 이런 연수는 조금 더 차시를 보완하여 30시간으로 개설해도 좋을 것 같습니다.",rate5,2022.08.30
1537,"기초학력의 첫걸음, 한글교육",1학년 지도를 할 때 한글에 대한 수준이 너무 커서 고민했었는데 어떻게 접근하고 지도할 지 알 수 있어 좋았습니다.,rate5,2022.08.30
1538,조병영의 문해력 수업,문해력과 관련된 연수를 찾다 본 연수를 들었습니다. 전반적인 문해력에 대한 이해와 더불어 개별 학습자의 특성을 기반으로 한 문해력 수업 방법을 고민해 볼 수 있는 시간이었습니다.,rate5,2022.08.30
1539,놀이와 질문이 함께하는 감동의 그림책 수업,"'놀이와 질문이 함께하는 감동의 그림책 수업' 연수 너무 좋았습니다.
이인희 강사님 진심으로 감사드립니다. 그리고 연수에 참여하신 8분 선생님, 늘 함께한 느낌입니다. 너무 감동적이어서 하나하나 빠짐없이 기록하며 들었습니다. 감사합니다.",rate5,2022.08.30
1540,정재승의 미래학교,미래학교 연수를 통해 현재 나의 모습을 뒤돌아보고 반성하게 하네요,rate4,2022.08.30
1541,뚝딱뚝딱 온앤오프 수업자료 만들기,"몰랐던 기능들을 알 수 .있고 익힐 수 있어서 많은 도움이 될듯합니다. 애써주신 강사님들께 감사드려요.
복습 수강이 가능했으면 좋겠습니다. 감사합니다.",rate5,2022.08.30
1542,학습격차를 줄이기 위한 슬기로운 수업방안,"마치 임용을 공부하는듯한 그런 ;;
초등수준에 맞는 교육방법인가 싶으면서도 다양한 수업방식을 제공함으로써
학생들이 쉽게 기초학력을 쌓아갈수 있도록 안내해줄수 있을것 같다.",rate5,2022.08.30
1543,놀이와 질문이 함께하는 감동의 그림책 수업,"이인희 선생님과 함께 한 30강의 그림책 놀이 수업!!~
진짜 한 강, 한 강 선생님의 땀과 사랑, 그리고 노력과 인내로 맺어진 결실이라 더욱 더 감동입니다. 선생님이 들려주는
시도 어쩜 그렇게 감동적일까요? 멋드러진, 또 사랑스럽게 들리는 기타 연주까지, 비록 선생님의 노래 실력이 소름돋게 잘
부르는 게 전혀 아니었지만 정말 그 누구보다도, 어떤 가수보다도 너무 감동적인 시간이었어요.... 한 강, 한 강 노트에 적고
너무 많이 들어 머리가 복잡해지는 것을 막으려고 조금씩 듣다보니 어느덧 종강 하루 전이네요..^^
알궁근적 본깨적~~ 이라는 리듬이 지금도 아련하게 들려오는 시간입니다.
알게 된 것을 통해 내가 깨달은 것을 생각해 보며 그것을 나의 삶에 적용하는 것이야말로 변화의 시작이겠죠?
아이들에게만 기적이 아니라 이 강의를 듣고 있는 지금 이 순간 저에게도 조금씩 기적이 싹트고 있음을 느끼며
아직 이 강의를 수강하지 않으신 선생님들께 강력 추천합니다!!~
감동과 사랑, 꿈, 희망, 모든 것을 경험하실 수 있을 것입니다!!~*^^* 좋은 강좌 열어주신 아이스크림 연수원에도 깊은 감사 드립니다.",rate5,2022.08.29
1544,"마을이 잇는 교육, 교육이 짓는 아이들 마을교육공동체(실무자편)",여러 사례등을 보여줘서 학습연구에 도움이 되었습니다.,rate5,2022.08.29
1545,온라인-오프라인 연계 수업 따라잡기,연수 내용이 다양한 교과에 걸쳐 나와서 좋았습니다.,rate5,2022.08.29
1546,정재승의 미래학교,미래사회에 적응할 수 있는 학생들을 위한 좋은 내용이 들어있는 연수였습니다,rate4,2022.08.27
1547,정재승의 미래학교,인간의 뇌가 가진 본래의 속성에 기반하여 미래가 된다고해도 모든것이 기계화되고 분절되고 기술집약 테크놀러지 시대가 되는 것이 아니라 오히려 그럴수록 인간은 서로 공감하고 협업하고 이해하고 존중하며 끊임없이 배우고 성장하려는 호기심을 길러야 한다는 말씀에 깊게 공감합니다.,rate5,2022.08.27
1548,똥손 교사도 할 수 있는 국어 수업 만들기,"잘 보았습니다.
많이 활용할 수 있을 것 같아요.
감사합니다~",rate5,2022.08.27
1549,두근두근! 1학년을 만나는 교사를 위한 한해살이 완벽 가이드 - 생활지도,유익한 연수 참고 잘 하겠습니다.,rate5,2022.08.26
1550,"4R'S로 키우는 힘, 기초학력교육",막연히 알고 있었던 내용을 구체적인 사례를 통해 연수하는 것이 많이 도움되어서 좋았습니다.,rate5,2022.08.26
1551,"기초학력의 첫걸음, 한글교육",지도할 수 있는 구체적인 방법을 알려 주셔서 도움이 되었습니다.,rate5,2022.08.26
1552,정재승의 미래학교,옆반 선생님의 추천으로 강의를 듣게 되었습니다. 미래는 점점 변화하고 있는데 교사인 저의 인식이 바뀔 필요성이 있음을 생각해 보게 하는 연수였습니다. 미래를 살아가게 될 우리 아이들을 생각하며 연수를 들으면 좋을 거 같습니다.,rate5,2022.08.26
1553,조병영의 문해력 수업,"학생들의 문해력 향상을 위한 교원 전문성을 신장하는 연수로 강추합니다.
30여년 전 초임 교사 때에 이런 연수가 있었으면 학생 수업에 더 많은 효과를 누렸을텐데 하는 아쉬움을 느꼈습니다.
이제라도 연수를 받게 되어서 참 다행이라는 생각이 듭니다.
감사합니다.",rate5,2022.08.25
1554,뚝딱뚝딱 온앤오프 수업자료 만들기,강사분들도 친절하고 자료도 충실합니다. 현장에서 많은 도움이 될 듯합니다.,rate5,2022.08.25
1555,"4R'S로 키우는 힘, 기초학력교육","도시 지역에 근무하며 학생들과 공부를 하며 당연하지 않은 것을 모두가 잘 하니 당연하게 느끼던 나의 모습을 반성하고
초심으로 돌아가 교육과 학습지도의 기본을 다시 한번 확인할 수 있는 기회였습니다.",rate5,2022.08.25
1556,"다함께 Green 미래 환경 교육, 기후위기에 대처하는 에코(ECO) 지식 토크쇼","최근 기후위기에 대한 관심도 높일 수 있고
구성이나 내용면에서도 흥미로운 부분이 많았습니다.
내용도 어렵지 않고 설명도 쉬워서 아이들과 함께 보아도 좋겠다는 생각을 했습니다.",rate5,2022.08.25
1557,"다함께 Green 미래 환경 교육, 기후위기에 대처하는 에코(ECO) 지식 토크쇼","자연 재해를 뉴스에서 자주 접해서 환경 오염에 관심이 더욱 커질 때 체계적인 지식을 접할 수 있어서 좋았다.

진행되는 방식도 재미있었고, 패널들의 지식을 통해 자연 보호를 통해 이 지구를 지켜나갈 수 있는 방안을 생각해 볼 수 있어서 좋았다. 아이들에게 정확한 지식 전달과 노력할 수 있는 방안을 강구하고 실천해 봐야 겠다.",rate5,2022.08.25
1558,핵심만 콕! 수업에 바로 쓰는 메타버스,"메타버스라는 말이 많이 들리지만 정확히 알지 못했는데, 이번 연수를 통해서 메타버스에 대한 개략적인 이해와 수업에 활용되는 예시를 이해할 수 있어서 좋았다.",rate5,2022.08.25
1559,조병영의 문해력 수업,문해력을 어떤 식으로 우리의 일상으로 끌고 올 것인지 고민하게 됨.,rate5,2022.08.24
1560,"학습격차, 차이를 넘어 함께 성장하기",학급에 여러 수준의 아이들에게 관심을 가지고 지도해야겠다,rate5,2022.08.24
1561,"학습격차, 차이를 넘어 함께 성장하기",학습이 어려운 친구들의 눈높이에 맞춤 교육을 하도록 노력해야겠어요.,rate5,2022.08.24
1562,"기초학력의 첫걸음, 한글교육",한글교육에 대한 이해를 시킬 수 있는 방법을 알 수 있어서 좋았습니다. 막연한 지도보다는 모듈을 알고 지도할 수 있겠습니다.,rate5,2022.08.24
1563,더 나은 삶을 위한 민주시민교육,학생들에게 민주시민 교육이 어려웠는데 좋은 강의로 방법에 대해 알게되었습니다.,rate5,2022.08.24
1564,놀이와 질문이 함께하는 감동의 그림책 수업,연수 제목이 정말 마음에 들어 연수 신청을 했는데 제목처럼 우리반 아이들과 그림책을 읽고 놀이와 질문이 함께 하는 감동있는 수업을 이인희 선생님처럼 해보렵니다~^^,rate5,2022.08.24
1565,정재승의 미래학교,"코로나 19, 기후변화 등의 영향으로 예상보다 빨리 우리 앞에 다가온 미래를 준비하기 위하여 우리 학생들에게 필요한 역량을 이해하여 학교에서 무엇을 어떻게 가르쳐야 할 것 인가에 대하여 알아보는 소중한 시간이었음",rate5,2022.08.23
1566,온라인-오프라인 연계 수업 따라잡기,코로나로 인해 교실 수업 모습이 정말 많이 변한 상황에서 온라인과 오프라인 수업을 제대로 이해하지 않으면 살아남을 수 없겠다는 생각에 이 연수를 선택하게 되었습니다. 2년 간의 코로나를 겪으면서 급작스럽게 배운 다양한 온라인 수업의 방법들이 머릿속에 뒤죽박죽 되어 있었는데 이 연수를 통해 잘 정리가 되었습니다. 또 잘 몰랐던 온라인 수업 방법들과 여러 가지 사이트나 앱들을 알 수 있게 되어서 유용하였습니다! 코로나가 다시 확산세에 있는데 언제 온라인으로 돌아갈 지 모르는 조마조마한 상황에서 이 연수를 잘 들었다고 생각합니다! 추천합니다~~~,rate5,2022.08.23
1567,서준호 선생님의 놀이 끝판왕 100,"학급경영 및 수업에 활용하기 좋은 실용적인 놀이들이 많습니다.
책만 읽었을 때는 와닿지 않았는데, 연수를 들으니 더욱 도움이 됩니다.
교실 및 강당, 운동장에서 다양하게 아이들과 함께하며 래포를 쌓는데 아주 유용할 것 같습니다.
좋은 연수 감사드립니다.",rate5,2022.08.23
1568,정재승의 미래학교,"비단 학생 교육면에서 뿐만 아니라, 교사 개인의 미래를 위해서 꼭 한번 들어보면 좋을것 같습니다.",rate5,2022.08.23
1569,참쌤의 비주얼씽킹 끝판왕,비주얼씽킹 교재를 보며 연수를 들으면 더욱 도움이 됩니다.,rate5,2022.08.23
1570,설민석의 한국사능력검정시험[심화],"연수를 신청하기 전에 후기를 많이 읽어보았기에 연수를 마치고 몇자 적습니다.

설샘의 한국사 연수를 들으며 내가 많이 무지했다는 것을 깨달았습니다. 올 여름은 너무 덥기도 하고 코로나19로 외출이 자유롭지 못했기 때문에 집에서 60시간 연수를 듣기로 결정했습니다.

예전에 큰별샘 연수를 들은적이 있기 때문에 기억을 살려 설샘의 한국사 연수를 열심히 들었습니다. 설샘의 한국사 연수는 우선 너무 재미가 있어서 60시간이 길다고 느껴지지 않았습니다. 연수를 중반쯤 들으니까 의미없이 연수를 듣지 말고 한국사검정시험을 봐야겠다는 의지가 생겼고 그래서 메모를 열심히 하고 역사적 사실로 찾아가며 즐겁게 연수를 들었습니다.

연수 시험보다 일주일 전에 한국사능력검정시험을 보았는데 그렇게나 많은 사람들이 어떠한 이유를 가지고 시험장에 왔는지 놀랍기도 했고 응시자 연령대가 다양해서 더 놀라왔습니다. 저도 나이가 적지 않은데 저보다 연배가 높으신 분도 많아서 나이탓을 하지 말아야겠다는 생각도 들었습니다.

연수 시험은 누군가의 후기처럼 조선, 근대, 현대에서 비중있게 나왔고 난이도도 무난하게 나왔던거 같습니다. 상대평가이다보니 어느 한 부분만 공부해서 될 것이 아니기 때문에 전체적으로 꼼꼼하게 공부하는게 고득점을 위해서는 좋을 듯 합니다. 저는 교재를 다 읽고 강의를 듣고 교재를 다시 보고 중요한 부분의 강의는 다시 반복해서 들었습니다.

감사하게도 한국사검정시험도 1급을 땄고, 연수에서도 좋은 성적을 얻었습니다.

설민석샘의 한국사 연수는 우선 꼼꼼하게 구성되어 있고 재미가 있으니 지겹지 않습니다. (강의할 때 설민석샘의 얼마나 피곤해 보이던지 쉬라고 말해주고 싶을때도 많았습니다. ) 역사적 사실은 원인과 결과가 있기 때문에 단편적으로 사실을 암기하기 보다 원인을 알려주시니까 결과를 이해하게 되고 기억에 오래 남았습니다. 아이들에게 지도할때도 원인을 알려주면 결과에 대해 짐작하게 해야겠다는 생각이 들었습니다.

두서없이 생각나는대로 적었습니다. 이 글을 읽는 선생님께서도 설민석 한국사능력검정시험(심화) 연수를 듣고 많은 배우시고 좋은 결과까지 얻어가길 바랍니다. 화이팅하세요!!",rate5,2022.08.23
1571,"기초학력의 첫걸음, 한글교육","초등학교 1학년 한굴 교육 전 꼭 필요한 연수로 생각됩니다. 한글 교육에 필요한 마음가짐, 한글의 특징을 알고 배우는 사람 입장을 생각하게 하여 도움이 많이 되었습니다.",rate5,2022.08.23
1572,"기초학력의 첫걸음, 한글교육",한글교육을 체계적으로 지도하는 방법을 알 수 있었어요 추천합니다~,rate5,2022.08.22
